{
  "$schema": "https://json-schema.org/draft/2020-12/schema",
  "$id": "https://rota-saude/schemas/lab/lab-report-v1.json",
  "title": "rotasaude.lab_report.v1",
  "description": "Laudo do laboratório municipal (ADR 0037; contrato §8; RDC 978/2025 art. 167). JSON canônico congelado na liberação: é o que a assinatura ICP (CAdES) cobre e de onde o PDF sai. Sem CPF.",
  "type": "object",
  "additionalProperties": false,
  "required": ["schema", "laboratory", "technical_lead", "released_by", "patient", "requisition_number", "exams", "partial",
               "issued_at", "signature_kind", "replaces_report_id", "rectification_reason", "support_laboratory"],
  "properties": {
    "schema": { "const": "rotasaude.lab_report.v1" },
    "laboratory": { "type": "object", "additionalProperties": false, "required": ["name", "cnes", "address", "phone"],
      "properties": { "name": { "type": "string", "minLength": 1 }, "cnes": { "type": "string", "pattern": "^[0-9]{7}$" },
                      "address": { "type": "string", "minLength": 1 }, "phone": { "type": "string", "pattern": "^[0-9]{10,11}$" } } },
    "technical_lead": { "$ref": "#/$defs/professional" },
    "released_by": { "$ref": "#/$defs/professional" },
    "patient": { "type": "object", "additionalProperties": false, "required": ["name", "birth_date", "biological_sex", "record_number"],
      "properties": { "name": { "type": "string", "minLength": 1 }, "birth_date": { "type": ["string", "null"], "pattern": "^[0-9]{4}-[0-9]{2}-[0-9]{2}$" },
                      "biological_sex": { "enum": ["male", "female"] }, "record_number": { "type": "string", "pattern": "^[0-9]{8}$" } } },
    "requisition_number": { "type": "string", "pattern": "^[0-9]{8}$" },
    "exams": { "type": "array", "minItems": 1, "items": { "$ref": "#/$defs/exam" } },
    "partial": { "type": "boolean" },
    "issued_at": { "type": "string", "pattern": "^[0-9]{4}-[0-9]{2}-[0-9]{2}T[0-9]{2}:[0-9]{2}:[0-9]{2}Z$" },
    "signature_kind": { "enum": ["icp", "advanced"] },
    "replaces_report_id": { "anyOf": [{ "$ref": "#/$defs/uuid" }, { "type": "null" }] },
    "rectification_reason": { "type": ["string", "null"], "maxLength": 500 },
    "support_laboratory": { "anyOf": [{ "type": "null" }, { "type": "object", "additionalProperties": false, "required": ["name", "cnes"],
      "properties": { "name": { "type": "string" }, "cnes": { "type": "string", "pattern": "^[0-9]{7}$" } } }] }
  },
  "$defs": {
    "uuid": { "type": "string", "pattern": "^[0-9a-f]{8}-[0-9a-f]{4}-[0-9a-f]{4}-[0-9a-f]{4}-[0-9a-f]{12}$" },
    "professional": { "type": "object", "additionalProperties": false, "required": ["name", "council", "council_uf", "council_number"],
      "properties": { "name": { "type": "string", "minLength": 1 }, "council": { "enum": ["CRF", "CRBM", "CRM"] },
                      "council_uf": { "type": "string", "pattern": "^[A-Z]{2}$" }, "council_number": { "type": "string", "pattern": "^[0-9]{1,10}$" } } },
    "exam": { "type": "object", "additionalProperties": false,
      "required": ["sigtap_code", "name", "material", "method", "version", "collected_at", "restriction_note", "components"],
      "properties": { "sigtap_code": { "type": "string", "pattern": "^02[0-9]{8}$" }, "name": { "type": "string" },
                      "material": { "type": "string" }, "method": { "type": "string" }, "version": { "type": "integer", "minimum": 1 },
                      "collected_at": { "type": "string", "pattern": "^[0-9]{4}-[0-9]{2}-[0-9]{2}T[0-9]{2}:[0-9]{2}:[0-9]{2}Z$" },
                      "restriction_note": { "type": ["string", "null"] },
                      "components": { "type": "array", "minItems": 1, "items": { "$ref": "#/$defs/component" } } } },
    "component": { "type": "object", "additionalProperties": false, "required": ["key", "name", "value", "unit", "flag", "reference_text", "loinc"],
      "properties": { "key": { "type": "string" }, "name": { "type": "string" }, "value": { "type": "string" }, "unit": { "type": ["string", "null"] },
                      "flag": { "enum": ["normal", "low", "high", "critical_low", "critical_high"] },
                      "reference_text": { "type": ["string", "null"] }, "loinc": { "type": ["string", "null"] } } }
  }
}
